{"$id":"https://randle.invalid/r6/future-review-receipt","$schema":"https://json-schema.org/draft/2020-12/schema","additionalProperties":false,"properties":{"accepted_specification_identity":{"pattern":"^[0-9a-f]{64}$","type":"string"},"authority_id":{"minLength":1,"type":"string"},"authorization_boundaries":{"items":{"minLength":1,"type":"string"},"maxItems":3,"minItems":3,"type":"array"},"compatibility_result":{"minLength":1,"type":"string"},"decision":{"minLength":1,"type":"string"},"independence_proof":{"minLength":1,"type":"string"},"issuance_event_identity":{"pattern":"^[0-9a-f]{64}$","type":"string"},"issued_timestamp":{"format":"date-time","type":"string"},"issuer":{"minLength":1,"type":"string"},"manifest_identity":{"pattern":"^[0-9a-f]{64}$","type":"string"},"reviewed_package_identity":{"pattern":"^[0-9a-f]{64}$","type":"string"},"reviewer_capability":{"minLength":1,"type":"string"},"reviewer_identity":{"minLength":1,"type":"string"},"reviewer_persona":{"minLength":1,"type":"string"},"schema_version":{"const":"6.0.0-DRAFT"},"script_identity":{"pattern":"^[0-9a-f]{64}$","type":"string"},"trust_root_identity":{"pattern":"^[0-9a-f]{64}$","type":"string"}},"required":["accepted_specification_identity","authority_id","authorization_boundaries","compatibility_result","decision","independence_proof","issuance_event_identity","issued_timestamp","issuer","manifest_identity","reviewed_package_identity","reviewer_capability","reviewer_identity","reviewer_persona","schema_version","script_identity","trust_root_identity"],"title":"future-review-receipt","type":"object"}
