{"accepted_specification_identity":"4444444444444444444444444444444444444444444444444444444444444444","authority_id":"R6-REVIEW-ISSUANCE-EVIDENCE","authorization_boundaries":["NO_CAPTURE_AUTHORIZATION","NO_DEPLOYMENT_AUTHORIZATION","NO_TRADING_AUTHORIZATION"],"compatibility_result":"COMPATIBLE_WITH_ACCEPTED_SPECIFICATION","decision":"ACCEPT","independence_proof":"INDEPENDENT_REVIEWER_NOT_PACKAGE_AUTHOR","issuance_event_identity":"5555555555555555555555555555555555555555555555555555555555555555","issued_timestamp":"2026-07-22T12:00:00Z","issuer":"R6-REVIEW-GOVERNANCE-ISSUER","manifest_identity":"2222222222222222222222222222222222222222222222222222222222222222","reviewed_package_identity":"1111111111111111111111111111111111111111111111111111111111111111","reviewer_capability":"ISSUE_BOUNDARY_PACKAGE_REVIEW","reviewer_identity":"R6-INDEPENDENT-REVIEWER-01","reviewer_persona":"INDEPENDENT_GOVERNANCE_REVIEWER","schema_version":"6.0.0-DRAFT","script_identity":"3333333333333333333333333333333333333333333333333333333333333333","trust_root_identity":"f4ae442d2c418aab129d94bea83cd9d23db444479b3d7c8e658224776fd3811f"}
